{
  "schema_v": 1,
  "vin": "1ADEV01A300000003",
  "seq": 1,
  "oem": "AsiaDrive",
  "lat": 41.95536,
  "lon": -87.69401,
  "geohash7": "dp3wsmx",
  "speed_kmh": 0,
  "soc_pct": 70.3,
  "odo_km": 12630.8,
  "batt_temp_c": 23.7,
  "charging": 0,
  "charge_kw": 0,
  "dtc": [],
  "evt": "NONE",
  "ts": "2026-09-30T10:00:00Z"
}