{
  "schema_v": 1,
  "vin": "1VXEV01A100000001",
  "seq": 1,
  "oem": "VoltX",
  "lat": 37.83257542718488,
  "lon": -122.4331108300111,
  "geohash7": "9q8zjzn",
  "speed_kmh": 0,
  "soc_pct": 67.23700938723724,
  "odo_km": 20283.9,
  "batt_temp_c": 27.17101080484639,
  "charging": 0,
  "charge_kw": 0,
  "dtc": [],
  "evt": "NONE",
  "ts": "2026-09-30T10:00:00Z"
}