{
  "schema_v": 1,
  "vin": "1EEEV01A600000004",
  "seq": 1,
  "oem": "EuroEV",
  "lat": 40.79734801324957,
  "lon": -73.92882311865786,
  "geohash7": "dr72jdy",
  "speed_kmh": 0,
  "soc_pct": 56.821120976474525,
  "odo_km": 28474.1,
  "batt_temp_c": 27.017953020039176,
  "charging": 0,
  "charge_kw": 0,
  "dtc": [],
  "evt": "NONE",
  "ts": "2026-09-30T10:00:00Z"
}