{
  "schema_v": 1,
  "vin": "1ZZEV01A500000005",
  "seq": 1,
  "oem": "ZephyrEV",
  "lat": 47.66692208075833,
  "lon": -122.3212834065991,
  "geohash7": "c23p0t2",
  "speed_kmh": 0,
  "soc_pct": 75.1,
  "odo_km": 49263.4,
  "batt_temp_c": 28.311695722157975,
  "charging": 0,
  "charge_kw": 0,
  "dtc": [],
  "evt": "NONE",
  "ts": "2026-09-30T10:00:00Z"
}